{
  "schema_version": "1.0",
  "run_id": "11111111-1111-4111-8111-111111111111",
  "asset": {"name": "synthetic-asset", "root": ".", "track": "code", "boundaries": ["repository-local files"]},
  "mode": "auto",
  "status": "ready",
  "stage": "strategize",
  "objective": "Produce one synthetic artifact.",
  "done_gate": ["The fixture passes its declared check."],
  "authority_grant_id": "22222222-2222-4222-8222-222222222222",
  "budgets": {"max_duration_seconds": 7200, "max_stage_attempts": 3, "max_mutations": 100, "max_external_actions": 0, "max_cost_usd": null},
  "usage": {"duration_seconds": 0, "stage_attempts": {"strategize": 0, "spec_pack": 0, "build": 0, "test": 0, "resolve": 0, "close": 0}, "mutations": 0, "external_actions": 0, "cost_usd": null},
  "owner": null,
  "selected_routes": {},
  "open_blocking_issues": 0,
  "last_heartbeat_at": null,
  "created_at": "2026-08-16T08:00:00Z",
  "updated_at": "2026-08-16T08:00:00Z",
  "terminal_reason": null
}
